"Child's name","Full name","SP reviewed (excl Scopes)","Comments/ Typos","Practice Area","GIC Industry","GIC Industry Group","Boilerplate Term?","COP26 Net Zero Chapter","Timeline Main Phase","Timeline Sub-Phase","NZ Scopes Field","Biodiversity","Just Transition","F - Corp Gov","F - Contract Emissions","F - Organisation emissions","F - Reporting & Disclosures","F - Corporate Mechanisms","F - Incentives, Enforcement, Disputes","F - Other environmental function","F - Just Transition","F - Resilience & Adaptation","F - Biodiversity"
"Agatha's Clause","Termination for Greener Supplier","Yes","Cross refer to Annie's clause","Commercial,Supply Chains","Universal","Universal","Yes","Law & Legal Structures","Breach / Termination ,Performance ","Supply Chain,Breach / Termination ,Supply Chain - Boilerplate ","Scope 2,Scope 3",,,,"Reducing contract emissions,Continuous reduction of contract emissions ","Commitment to specific standards/ targets","Report on contract emissions,""Reporting to contract parties or related third parties (investors, shareholders, insurers) "",""Measuring, reducing, reporting Scope 2 emissions "",""Measuring, reducing, reporting Scope 3 emissions """,,"Termination right,Dispute resolution frameworks and processes",,"Query impact/ Adverse",,
"Alex’s Clause","Circular Economy Product Design Obligation","Yes",,"Commercial,""IP, IT, TMT, Life Sciences, Data Protection & Information Law"",Supply Chains","Energy ,Industrials,Consumer Discretionary,Consumer Staples,Healthcare,Information Technology,Utilities,Materials","Energy ,Materials ,Capital Goods,Transportation ,Automobiles & Components ,Consumer Durables & Apparel,Retailing ,Food Staples Retailing ,""Food, Beverages & Tobacco"",Household & Personal Products,Healthcare Equipment & Services,""Pharmaceuticals, Biotechnology & Life Sciences "",Software & Services,Technology Hardware & Equipment,Semiconductors & Semiconductor Equipment,Utilities,Universal","No","""Industry (including Heavy Industry, Retail & FMCG, ICT & Media)"",Law & Legal Structures ","Performance","Supply Chain,""Energy, Infrastructure & Transport "",""Real Estate, Construction & Development""","Scope 1,Scope 2,Scope 3",,,,,,,,,,,,
"Alice’s Clause","Reduction of CO2 from Single Use Plastic","Yes","Drafting for all CO2 emitting products","Commercial,Public Sector (including Public Law & Local Government),Supply Chains","Industrials,Materials","Materials ,Capital Goods","No","Law & Legal Structures ,""Industry (including Heavy Industry, Retail & FMCG, ICT & Media)""","Performance","Supply Chain",,,,,,,,,,,,,
"Annie's Clause","Carbon Termination (Short Form)","Yes","Cross refer to Agatha's clause","Commercial,Supply Chains","Universal","Universal","Yes","Law & Legal Structures","Performance","Supply Chain - Boilerplate ,Supply Chain",,,,,,,,,,,,,
"Archie’s Clause","Premium Adjustment for D&O Climate-related Financial Disclosures","Yes",,"Insurance","Financials","Insurance","No","""Finance, Accounting & Tax"",Resilience (Mitigation & Adaptation) ","Pre-Contract","Risk & Insurance",,,,,,,,,,,,,
"Arlo’s Clause","ESG Aligned Company Articlesx","Yes",,"Corporate ","Universal","Universal","No","Law & Legal Structures","Pre-Contract","Corporate Governance",,,"Just Transition",,,,,,,,,,
"Austen’s Clause","Sustainability Clauses in Supply Chain Contracts","Yes",,"Commercial,Supply Chains","Universal","Universal","No","Law & Legal Structures","Procurement ,Performance ","Supply Chain",,,,,,,,,,,,,
"Bella’s Clause","Management Equity Ratchet Terms","Yes",,"""Finance, Financial Services & Capital Markets"",Corporate ,Employment (including Share Schemes & Incentives & Pensions)","Financials ,Industrials","Diversified Financials ,Commercial & Professional Services","No","Law & Legal Structures ,""Finance, Accounting & Tax""","Pre-Contract","Corporate Governance","Scope 1,Scope 2,Scope 3",,,,,,,,,,,,
"Callum & Theo’s Clause","Climate Standard Transaction Terms","Yes",,"Corporate ,""Finance, Financial Services & Capital Markets""","Financials","Diversified Financials","No","""Human Settlements, Buildings and Infrastructure"",""Finance, Accounting & Tax""","Pre-Contract","Financing & Investment","Scope 1,Scope 2,Scope 3",,,,,,,,,,,,
"Casper’s Clause","Sustainability-Linked Loans","Yes",,"""Finance, Financial Services & Capital Markets""","Financials","Diversified Financials","No","""Finance, Accounting & Tax""","Pre-Contract","Financing & Investment",,,,,,,,,,,,,
"Chloe’s Clause","Environmental Business Charter","Yes",,"Commercial,Employment (including Share Schemes & Incentives & Pensions),Corporate ","Universal,Industrials","Universal,Commercial & Professional Services","No","Law & Legal Structures","Pre-Contract","Corporate Governance","Scope 1,Scope 3",,"Just Transition",,,,,,,,,,
"Connor’s Clause","Exclusions from insurance coverage for climate harms","Yes",,"Insurance","Financials","Insurance","No","""Finance, Accounting & Tax"",Resilience (Mitigation & Adaptation) ","Pre-Contract","Risk & Insurance","Scope 1,Scope 2,Scope 3",,"Just Transition",,,,,,,,,,
"Darcy’s Board Minutes","Climate Change Aligned Board Minutes","Yes",,"Corporate ","Universal","Universal","No","""Finance, Accounting & Tax"",Law & Legal Structures ","Pre-Contract,Performance ","Corporate Governance",,,"Just Transition",,,,,,,,,,
"Dottie’s Clause","Climate Underwriting Sponsor Warranties","Yes",,"Corporate ,Commercial,Insurance","Financials","Diversified Financials","No","""Finance, Accounting & Tax"",Law & Legal Structures ","Pre-Contract","Financing & Investment,Risk & Insurance ","Scope 1,Scope 2",,"Just Transition",,,,,,,,,,
"Edgar’s Clause","Climate Resilient landscape design contracts","Yes",,"""Buildings & Land (including Property, Construction, Environment & Planning)"",""Heavy Industry (including Energy, Infrastructure & Transport)""","Real Estate","Real Estate","No","""Human Settlements, Buildings and Infrastructure""","Procurement ,Performance ","""Energy, Infrastructure & Transport "",""Real Estate, Construction & Development""",,"Biodiversity","Just Transition",,,,,,,,,,
"Elliot’s Handbook","Net Zero Employment Handbook","Yes",,"Employment (including Share Schemes & Incentives & Pensions),Corporate ","Universal,Industrials","Universal,Commercial & Professional Services","No","People","Pre-Contract,Performance ","Corporate Governance,Employment & Pensions",,,,,,,,,,,,,
"Emilia’s Protocols","Green litigation and arbitration protocols","Yes",,"Dispute Resolution & Arbitration,Commercial","Universal","Universal","Yes","Law & Legal Structures","Dispute Resolution","Dispute Resolution",,,,,,,,,,,,,
"Emma's Clause","Green Residential Lease","Yes",,"""Buildings & Land (including Property, Construction, Environment & Planning)""","Real Estate","Real Estate","No","""Human Settlements, Buildings and Infrastructure""","Performance","""Real Estate, Construction & Development""",,,,,,,,,,,,,
"Eric’s Clause","Climate Gardening Leave","Yes",,"Employment (including Share Schemes & Incentives & Pensions),Commercial","Universal,Industrials","Universal,Commercial & Professional Services","No","People","Performance","Employment & Pensions",,,"Just Transition",,,,,,,,,,
"Estelle’s Clause","Net Zero Construction Standards","Yes","Include the type of contract clauses go into on website - ALL CLAUSES 

","""Buildings & Land (including Property, Construction, Environment & Planning)"",""Heavy Industry (including Energy, Infrastructure & Transport)""","Materials,Industrials,Energy ","Materials ,Capital Goods,Transportation ,Energy ","No","""Human Settlements, Buildings and Infrastructure""","Performance ,Procurement ","""Real Estate, Construction & Development"",""Energy, Infrastructure & Transport ""","Scope 1,Scope 3",,,,,,,,,,,,
"Evelyn and Ezra’s Clause","Securing Net Zero in planning development projects","Yes",,"""Buildings & Land (including Property, Construction, Environment & Planning)"",""Heavy Industry (including Energy, Infrastructure & Transport)""","Real Estate,Industrials","Real Estate,Capital Goods,Transportation ","No","""Human Settlements, Buildings and Infrastructure""","Pre-Contract,Procurement ","""Real Estate, Construction & Development"",""Energy, Infrastructure & Transport """,,,,,,,,,,,,,
"Francis’ Clause","Climate Aligned Construction Waste Management","Yes",,"""Buildings & Land (including Property, Construction, Environment & Planning)""","Industrials,Materials","Capital Goods,Materials ","No","""Human Settlements, Buildings and Infrastructure""","Procurement ,Performance ","""Real Estate, Construction & Development""",,,"Just Transition",,,,,,,,,,
"Frank's Clause","Green Investment Obligations","Yes",,"""Finance, Financial Services & Capital Markets"",Corporate ","Financials ,Universal","Diversified Financials ,Universal","No","Law & Legal Structures ,""Finance, Accounting & Tax""","Pre-Contract","Financing & Investment","Scope 1,Scope 2,Scope 3","Biodiversity","Just Transition",,,,,,,,,,
"Gordon’s DDQ","Capital Markets ESG Due Diligence Questionnaire","Yes",,"""Finance, Financial Services & Capital Markets"",Corporate ","Financials ,Universal","Diversified Financials ,Universal","No","""Finance, Accounting & Tax""","Pre-Contract,Procurement ","Financing & Investment,Diligence",,"Biodiversity",,,,,,,,,,,
"Hanley’s Clause","Climate Change Aligned Heads of Terms","Yes",,"Corporate ","Universal","Universal","No","Law & Legal Structures","Pre-Contract,Procurement ","Pre-Contract Terms",,,"Just Transition",,,,,,,,,,
"Harrison’s Clause","Green Loan Starter Pack","Yes",,"""Finance, Financial Services & Capital Markets""","Financials","Diversified Financials","No","""Finance, Accounting & Tax""","Pre-Contract","Financing & Investment",,,"Just Transition",,,,,,,,,,
"Iris’s Clause","Climate Risk Sharing Provisions","Yes",,"Commercial,Universal,Public Sector (including Public Law & Local Government),Supply Chains","Universal","Universal","Yes","Law & Legal Structures ,Resilience (Mitigation & Adaptation) ","Performance","Supply Chain - Boilerplate ,Supply Chain",,,,,,,,,,,,,
"Jessica's Clause","Carbon Performance Clauses","Yes",,"Commercial,Universal,Supply Chains","Universal","Universal","Yes","Law & Legal Structures","Performance","Supply Chain - Boilerplate ,Supply Chain","Scope 1,Scope 2,Scope 3",,"Just Transition",,,,,,,,,,
"Kaia’s Clause","Climate Purposed NDA Terms","Yes",,"Commercial,Corporate ","Universal","Universal","No","Law & Legal Structures","Procurement ,Pre-Contract","Pre-Contract Terms",,,"Just Transition",,,,,,,,,,
"Lauren’s Clause","Green Shareholders’ Agreement","Yes",,"Corporate ","Universal","Universal","No","Law & Legal Structures ,""Finance, Accounting & Tax""","Pre-Contract","Corporate Governance","Scope 1,Scope 2",,"Just Transition",,,,,,,,,,
"Lola & Harry’s DDQ","Climate and Net Zero Due Diligence","Yes",,"Corporate ","Universal","Universal","No","Law & Legal Structures","Pre-Contract,Procurement ","Diligence","Scope 1,Scope 2,Scope 3",,"Just Transition",,,,,,,,,,
"Luna's Clause","Green Construction Modifications","Yes",,"""Buildings & Land (including Property, Construction, Environment & Planning)""","Industrials,Materials","Capital Goods,Materials ","No","""Human Settlements, Buildings and Infrastructure"",Resilience (Mitigation & Adaptation) ","Performance","""Real Estate, Construction & Development""","Scope 1,Scope 2,Scope 3","Biodiversity",,,,,,,,,,,
"Maria’s Scorecard","Supply Chain Emissions Scorecard","Yes",,"Corporate ,Commercial,Public Sector (including Public Law & Local Government),Supply Chains","Universal","Universal","No","Law & Legal Structures","Pre-Contract","Corporate Governance","Scope 1,Scope 2,Scope 3",,"Just Transition",,,,,,,,,,
"Marni’s Clause","Report on Title Climate Change Clauses","Yes",,"""Buildings & Land (including Property, Construction, Environment & Planning)""","Real Estate","Real Estate","No","""Human Settlements, Buildings and Infrastructure"",Resilience (Mitigation & Adaptation) ","Pre-Contract","Diligence",,,,,,,,,,,,,
"Mary’s Clause","Build Contract Energy Efficiency Clauses","Yes",,"""Buildings & Land (including Property, Construction, Environment & Planning)""","Real Estate,Materials","Real Estate,Materials ","No","""Human Settlements, Buildings and Infrastructure""","Performance","""Real Estate, Construction & Development""","Scope 1,Scope 2,Scope 3",,,,,,,,,,,,
"Mia’s Clause","Low Carbon arbitration hearings clause","Yes",,"Dispute Resolution & Arbitration","Universal","Universal","Yes","Law & Legal Structures","Dispute Resolution","Dispute Resolution","Scope 1,Scope 3",,,,,,,,,,,,
"Nozomi’s Clause","Net Zero Convertible Loan Note","Yes","Typos - see CMM","""Finance, Financial Services & Capital Markets"",Corporate ","Financials","Diversified Financials","No","Law & Legal Structures ,""Finance, Accounting & Tax""","Pre-Contract","Financing & Investment","Scope 1,Scope 2",,"Just Transition",,,,,,,,,,
"Owen’s Clause","Net Zero Target Supply Chain Cascade","Yes","Amend user notes to consider having an incentive where the cost savings from not having to off set are shared with supplier. 
Why is this clause numbered [8]?!?
Weird font change in 8.2 (f)","Commercial,Supply Chains","Universal","Universal","No","Law & Legal Structures","Performance","Supply Chain,Supply Chain - Boilerplate ","Scope 1,Scope 2,Scope 3",,"Just Transition",,,,,,,,,,
"Philippe’s Clause","Invitation to Tender Green Obligations","Yes",,"Employment (including Share Schemes & Incentives & Pensions),Universal","Universal","Universal","No","People,Just Transition ,Resilience (Mitigation & Adaptation) ","Pre-Contract,Procurement ","Invitation to Tender",,,"Just Transition",,,,,,,,,,
"Rory's Clause","Net Zero Land Promotion","Yes",,"""Buildings & Land (including Property, Construction, Environment & Planning)""","Real Estate","Real Estate","No","""Human Settlements, Buildings and Infrastructure"",Land Use & Agriculture","Pre-Contract,Procurement ","""Real Estate, Construction & Development""","Scope 1,Scope 2,Scope 3","Biodiversity","Just Transition",,,,,,,,,,
"Rosie’s Clause","Alteration/improvement provisions within leases to improve climate/ environmental impact of buildings and better use of shared space","Yes",,"""Buildings & Land (including Property, Construction, Environment & Planning)""","Real Estate","Real Estate","No","""Human Settlements, Buildings and Infrastructure""","Performance","""Real Estate, Construction & Development""","Scope 1",,"Just Transition",,,,,,,,,,
"Sava’s Clause","Sustainable Connectivity in Rail Franchise Agreements","Yes","Define TOC in explanatory paragraph. Don't use acronym TOC before it has been defined (which it's not until ""why use this?"").","Commercial,""Heavy Industry (including Energy, Infrastructure & Transport)""","Industrials,Utilities","Transportation ,Utilities","No","Transport","Performance","""Energy, Infrastructure & Transport """,,,,,,,,,,,,,
"Sienna’s Clause","Green Acquisition Obligations","Yes",,"Corporate ","Universal,Financials ","Universal,Diversified Financials ","No","Law & Legal Structures ,""Finance, Accounting & Tax""","Pre-Contract","Financing & Investment","Scope 1,Scope 2,Scope 3",,"Just Transition",,,,,,,,,,
"Teddy's Clause","Environmental Threshold Obligations","Yes",,"Commercial,Supply Chains","Universal","Universal","No","Law & Legal Structures","Pre-Contract,Procurement ","General,Supply Chain",,,"Just Transition",,,,,,,,,,
"Toby’s Clause","Avoidance of excessive paperwork in Dispute Resolution – including both litigation and arbitration.","Yes",,"Dispute Resolution & Arbitration","Universal","Universal","Yes","Law & Legal Structures","Dispute Resolution","Dispute Resolution","Scope 1,Scope 3",,,,,,,,,,,,
"Toryn's Clause","Green Assured Shorthold Tenancy","Yes",,"""Buildings & Land (including Property, Construction, Environment & Planning)""","Real Estate","Real Estate","No","""Human Settlements, Buildings and Infrastructure""","Performance","""Real Estate, Construction & Development""","Scope 1,Scope 2",,,,,,,,,,,,
"Tristan’s Clause","Construction Materials: Procurement","Yes",,"""Buildings & Land (including Property, Construction, Environment & Planning)""","Real Estate,Materials,Industrials","Real Estate,Materials ,Capital Goods","No","""Human Settlements, Buildings and Infrastructure""","Performance","""Real Estate, Construction & Development""","Scope 1,Scope 2,Scope 3",,,,,,,,,,,,
"Zack’s Clause","SPA/Investment Agreement Disclosure of Climate Change Plans","Yes",,"Corporate ,""Finance, Financial Services & Capital Markets""","Universal,Financials ","Universal,Diversified Financials ","No","Law & Legal Structures ,""Finance, Accounting & Tax""","Pre-Contract","Financing & Investment,Diligence","Scope 1,Scope 2,Scope 3",,"Just Transition",,,,,,,,,,
"Zain’s Clause","Carbon Change Rights- Carbon Footprint Reduction - Mutual Notification Right (Carbon Footprint Reduction Notice)","Yes",,"Commercial,Supply Chains","Universal","Universal","Yes","Law & Legal Structures","Performance","Supply Chain - Boilerplate ,Supply Chain",,,,,,,,,,,,,
"Zoë and Bea’s Clause","Green Supply Agreement Clauses","Yes",,"Commercial,Corporate ,Public Sector (including Public Law & Local Government),Supply Chains","Universal","Universal","Yes","Law & Legal Structures","Performance","Supply Chain,Supply Chain - Boilerplate ","Scope 1,Scope 2,Scope 3",,"Just Transition",,,,,,,,,,
"Aatmay's Clause","Sustainable and Circular Economy Principles in Leasing Arrangements for Repairs and Alterations","Yes",,"""Buildings & Land (including Property, Construction, Environment & Planning)""","Real Estate,Materials","Real Estate,Materials ","No","""Human Settlements, Buildings and Infrastructure""","Performance","""Real Estate, Construction & Development""",,,,,"Reducing contract emissions,Continuous reduction of contract emissions ","Reducing organisation emissions,Commitment to specific standards/ targets",,,,"Reducing travel,Circular economy","Query impact/ Adverse",,
"Ashkan's Clause","Sustainable On Site Working Practices","Yes",,"""Buildings & Land (including Property, Construction, Environment & Planning)""","Industrials","Capital Goods","No","""Human Settlements, Buildings and Infrastructure""","Performance","""Real Estate, Construction & Development""","Scope 1,Scope 2",,"Just Transition",,,,,,,,,,
"Leo & Molly's Clause","Choice of Green Governing Law Clause","Yes",,"Dispute Resolution & Arbitration,Commercial","Universal","Universal","Yes","Law & Legal Structures","Dispute Resolution","Dispute Resolution",,,,,,,,,,,,,
"Larissa's Clause","A set of Facility Agreement clauses promoting sustainability-linked loans within the cement industry.","Yes",,"""Finance, Financial Services & Capital Markets"",""Buildings & Land (including Property, Construction, Environment & Planning)""","Financials ,Materials","Diversified Financials ,Materials ","No","""Finance, Accounting & Tax"",""Industry (including Heavy Industry, Retail & FMCG, ICT & Media)""","Pre-Contract,Performance ","Financing & Investment",,,"Just Transition",,,,,,,,,,
"Anna's Clause","Climate Related Disclosure in Loans","Yes",,"""Finance, Financial Services & Capital Markets""","Financials","Diversified Financials","No","""Finance, Accounting & Tax""","Pre-Contract,Performance ","Financing & Investment",,"Biodiversity",,,,,,,,,,,
"Otto's Clause","Energy Efficiency in Shipping","Yes",,"""Heavy Industry (including Energy, Infrastructure & Transport)""","Industrials,Energy ,Utilities","Transportation ,Energy ,Utilities","No","Transport","Performance","""Energy, Infrastructure & Transport """,,,,,,,,,,,,,
"Joni's Clause","Promotion of Sustainable Consumption and Travel in TV Production","Yes",,"Commercial,""IP, IT, TMT, Life Sciences, Data Protection & Information Law""","Communication Services","Media & Entertainment","No","""Industry (including Heavy Industry, Retail & FMCG, ICT & Media)"",People","Performance","General",,,,,,,,,,,,,
"Lewi's Clause","Green Film Production Credits","Yes",,"Commercial,""IP, IT, TMT, Life Sciences, Data Protection & Information Law""","Communication Services","Media & Entertainment","No","""Industry (including Heavy Industry, Retail & FMCG, ICT & Media)"",People","Performance","General",,,,,,,,,,,,,
"Evan's Protocols","Green Transaction Execution Protocols","Yes",,"Corporate ,Commercial,""Finance, Financial Services & Capital Markets""","Universal,Financials ","Universal,Diversified Financials ","No","""Finance, Accounting & Tax"",Law & Legal Structures ","Pre-Contract,Procurement ","Pre-Contract Terms,Diligence,Invitation to Tender","Scope 1,Scope 2,Scope 3",,,,,,,,,,,,
"Felix's Clause","Net Zero Completion Adjustment clause","Yes",,"Corporate ,""Finance, Financial Services & Capital Markets""","Financials ,Universal","Diversified Financials ,Universal","No","""Finance, Accounting & Tax"",Law & Legal Structures ","Pre-Contract","Financing & Investment","Scope 1,Scope 2,Scope 3",,,,,,,,,,,,
"Scarlett's Performance Conditions","ESG Based Performance Conditions for Employee Incentive Awards","Yes",,"Employment (including Share Schemes & Incentives & Pensions),Corporate ","Universal","Universal","No","People","Pre-Contract","Employment & Pensions,Corporate Governance","Scope 1,Scope 2,Scope 3",,"Just Transition",,,,,,,,,,
"Athena's Clause","Employee Climate Engagement Provisions","Yes",,"Employment (including Share Schemes & Incentives & Pensions),Commercial,Supply Chains","Universal,Industrials","Universal,Commercial & Professional Services","No","People,Law & Legal Structures ","Performance","Employment & Pensions",,,,,,,,,,,,,
"Benjamin's Licence","Climate Solutions IPR Licence","Yes",,"""IP, IT, TMT, Life Sciences, Data Protection & Information Law""","Universal","Universal","No","""Industry (including Heavy Industry, Retail & FMCG, ICT & Media)""","Performance","General",,,,,,,,,,,,,
"Matthew's Clause","Late Payment – Green Interest Remedies","Yes",,"Commercial,Universal","Universal","Universal","Yes","Law & Legal Structures","Performance","Supply Chain - Boilerplate ,Supply Chain",,,,,,,,,,,,,
"Nico's Clause","Cooler-Plate Clauses (Climate Aligned Boilerplate)","Yes","Insert cross references to boiler plate Gov Law (Molly & Leo) and Dispute Resolution  clauses referred to in this list (Toby, Mia, Emilia) ","Commercial,Universal","Universal","Universal","Yes","Law & Legal Structures","Performance","Supply Chain - Boilerplate ,Supply Chain,Dispute Resolution",,,,,,,,,,,,,
"Luke's Clause","The 'Green Supplier' Contract – a standardised contractual pricing model which uses incentives to ensure the maintenance of agreed sustainable objectives between a supplier and purchaser","Yes",,"Commercial,Supply Chains","Universal","Universal","No","Law & Legal Structures","Performance","Supply Chain - Boilerplate ,Supply Chain","Scope 1,Scope 2,Scope 3",,"Just Transition",,,,,,,,,,
"Georgie's Clause","Promotion of Carbon Sinks and Ecological Restoration in Lettings of Rural Land","Yes",,"""Buildings & Land (including Property, Construction, Environment & Planning)""","Real Estate","Real Estate","No","""Human Settlements, Buildings and Infrastructure"",Land Use & Agriculture","Performance","""Real Estate, Construction & Development""",,"Biodiversity",,,,,,,,,,,
"Caesar's Clause","Greener and More Efficient HGVs in Road and Multimodal Transport Agreements","Yes",,"Commercial,""Heavy Industry (including Energy, Infrastructure & Transport)""","Industrials,Energy ,Universal","Transportation ,Energy ,Universal","No","Transport,Law & Legal Structures ","Performance","""Energy, Infrastructure & Transport ""","Scope 1,Scope 3",,"Just Transition",,,,,,,,,,
"Izzy's Clause","Benchmarking of project greenhouse gas (GHG) emissions","Yes",,"""Buildings & Land (including Property, Construction, Environment & Planning)"",Commercial,Supply Chains","Universal,Industrials","Universal,Capital Goods","No","Law & Legal Structures ,""Human Settlements, Buildings and Infrastructure""","Performance","Supply Chain - Boilerplate ,Supply Chain,""Real Estate, Construction & Development""",,,"Just Transition",,,,,,,,,,
"Clara's Guide And Checklist","Guide and checklist for issuance of Sustainability-Linked Loans","Yes",,"""Finance, Financial Services & Capital Markets""","Financials","Diversified Financials","No","""Finance, Accounting & Tax""","Pre-Contract,Performance ","Financing & Investment",,,,,,,,,,,,,
"Ming's Clause","Target Product Carbon Footprint (Schedule for Consumer Goods Contracts)","Yes",,"Commercial,""IP, IT, TMT, Life Sciences, Data Protection & Information Law"",Supply Chains","Materials,Industrials,Consumer Discretionary,Consumer Staples,Healthcare,Information Technology","Materials ,Capital Goods,Transportation ,Automobiles & Components ,Consumer Durables & Apparel,Retailing ,Food Staples Retailing ,""Food, Beverages & Tobacco"",Household & Personal Products,Healthcare Equipment & Services,""Pharmaceuticals, Biotechnology & Life Sciences "",Software & Services,Technology Hardware & Equipment,Semiconductors & Semiconductor Equipment","No","Law & Legal Structures","Performance","Supply Chain - Boilerplate ,Supply Chain,""Energy, Infrastructure & Transport "",""Real Estate, Construction & Development""","Scope 1,Scope 2,Scope 3",,"Just Transition",,,,,,,,,,
"Helen's Clause","Promotion of Regenerative Farming Methods by using Profit a Pasturage Agreements","Yes",,"""Buildings & Land (including Property, Construction, Environment & Planning)""","Real Estate","Real Estate","No","Law & Legal Structures ,Land Use & Agriculture","Performance","""Real Estate, Construction & Development""",,"Biodiversity",,,,,,,,,,,
