"Orli's Clause","Conservation Covenant for Soil Preservation and Enhancement","Yes",,"""Buildings & Land (including Property, Construction, Environment & Planning)""","Real Estate","Real Estate","No","Land Use & Agriculture,Resilience (Mitigation & Adaptation) ","Pre-Contract,Procurement ","""Real Estate, Construction & Development"",""Energy, Infrastructure & Transport ""","Scope 3","Biodiversity",,,,,,,,,,,
"Rowen's Clause","Sustainable Land Use and Management Clause in Supply Chain Contracts and associated Self-Assessment Questionnaire","Yes",,"""Buildings & Land (including Property, Construction, Environment & Planning)"",Commercial,Public Sector (including Public Law & Local Government),Supply Chains","Real Estate,Consumer Staples,Materials,Industrials,Consumer Discretionary,Universal","Real Estate,""Food, Beverages & Tobacco"",Materials ,Capital Goods,Consumer Services ,Consumer Durables & Apparel,Food Staples Retailing ","No","Land Use & Agriculture","Performance","""Real Estate, Construction & Development"",Supply Chain","Scope 3,Scope 2","Biodiversity",,,,,,,,,,,
"Runa's Clause","Reducing Food Waste in the Supply Chain","Yes",,"Commercial,Supply Chains","Consumer Discretionary,Industrials,Consumer Staples,Universal","""Food, Beverages & Tobacco"",Consumer Services ,Food Staples Retailing ,Universal","No","Land Use & Agriculture","Procurement ,Performance ,Pre-Contract","Diligence,Supply Chain,""Real Estate, Construction & Development""",,,,,,,,,,,,,
"William's Clause","Heads of Terms for Collaboration Agreement between Landowners for Environmental Schemes/Projects","Yes",,"""Buildings & Land (including Property, Construction, Environment & Planning)"",Public Sector (including Public Law & Local Government)","Real Estate","Real Estate","No","Land Use & Agriculture","Performance","""Real Estate, Construction & Development""",,"Biodiversity",,,,,,,,,,,
"Conny's Clause","Novation of Obligations in Climate Retrofitting Contracts to Successors in Title","Yes",,"""Buildings & Land (including Property, Construction, Environment & Planning)"",Public Sector (including Public Law & Local Government)","Real Estate,Financials ","Real Estate,Banks","No","""Human Settlements, Buildings and Infrastructure"",Resilience (Mitigation & Adaptation) ","Performance","""Real Estate, Construction & Development""","Scope 2",,,,,,,,,,,,
"Hannah's Clause","Green Service Charge Provisions for Commercial Leases","Yes","Cf Lotta
","""Buildings & Land (including Property, Construction, Environment & Planning)""","Real Estate","Real Estate","No","""Human Settlements, Buildings and Infrastructure"",Resilience (Mitigation & Adaptation) ","Performance","""Real Estate, Construction & Development""",,"Biodiversity",,,,,,,,,,,
"Lotta's Clause","Landlords to provide Electricity from Renewable Sources","Yes","Cf Hannah","""Buildings & Land (including Property, Construction, Environment & Planning)""","Real Estate","Real Estate","No","""Human Settlements, Buildings and Infrastructure""","Performance","""Real Estate, Construction & Development""","Scope 2",,,,,,,,,,,,
"Tomas' Clause","CLLS Certificate of Title - Additional Climate Change Disclosures","Yes",,"""Buildings & Land (including Property, Construction, Environment & Planning)""","Real Estate","Real Estate","No","""Human Settlements, Buildings and Infrastructure""","Performance","""Real Estate, Construction & Development""","Scope 2",,,,,,,,,,,,
"Bailey's Clause","Extended Drafting for Sustainability-Linked Facilities","Yes","Cf Casper","""Finance, Financial Services & Capital Markets""","Financials","Diversified Financials","No","""Finance, Accounting & Tax""","Pre-Contract","Financing & Investment",,,,,,,,,,,,,
"Lara's Clause","ESG-Linked Pricing Adjustment for Derivatives Transactions","Yes",,"""Finance, Financial Services & Capital Markets""","Financials","Diversified Financials","No","""Finance, Accounting & Tax""","Pre-Contract","Financing & Investment",,,,,,,,,,,,,
"Olivia's Clause","Incorporating Net Zero Obligations for Contractors and Subcontractors in Engineering, Procurement and Construction (EPC) Contracts to ensure Sustainability at All Levels of a Project","Yes","Cf Rose
","""Finance, Financial Services & Capital Markets"",""Buildings & Land (including Property, Construction, Environment & Planning)""","Financials ,Materials","Diversified Financials ,Materials ","No","""Finance, Accounting & Tax"",""Human Settlements, Buildings and Infrastructure""","Pre-Contract","Financing & Investment",,,,,,,,,,,,,
"Gaia's Clause","Sustainability-Linked Project Finance","Yes",,"""Finance, Financial Services & Capital Markets"",""Buildings & Land (including Property, Construction, Environment & Planning)""","Financials ,Materials","Diversified Financials ,Materials ","No","""Finance, Accounting & Tax"",""Human Settlements, Buildings and Infrastructure""","Pre-Contract,Procurement ","Financing & Investment",,,,,,,,,,,,,
"Tilly's Clause","Checklist of Climate Change Risk Factors for Prospectuses","Yes",,"""Finance, Financial Services & Capital Markets""","Financials","Diversified Financials","No","""Finance, Accounting & Tax""","Pre-Contract","Financing & Investment,Diligence",,,,,,,,,,,,,
"Stella & Flora's Clause","Environmental Targets for a Limited Partnership Agreement","Yes",,"""Finance, Financial Services & Capital Markets""","Financials","Diversified Financials","No","""Finance, Accounting & Tax""","Pre-Contract","Financing & Investment","Scope 1,Scope 2,Scope 3",,,,,,,,,,,,
"Cassie's Clause","Extending Insurance Policy Cover for Pending Climate Change Litigation conditional upon Policyholder Disclosure of Net Zero Targets and Exposure to Climate Risk","Yes",,"Insurance","Financials","Insurance","No","""Finance, Accounting & Tax""","Pre-Contract","Risk & Insurance","Scope 1,Scope 2,Scope 3",,,,,,,,,,,,
"Charlotte's Clause","Green Dispute Resolution Reporting Requirements in After the Event (ATE) Insurance Policies","Yes",,"Insurance","Financials","Insurance","No","""Finance, Accounting & Tax""","Pre-Contract","Risk & Insurance",,,,,,,,,,,,,
"Kitty's Clause","General Condition to Commercial Insurance Policies - Climate Change Risk Assessment","Yes",,"Insurance","Financials","Insurance","No","""Finance, Accounting & Tax""","Pre-Contract","Risk & Insurance",,,,,,,,,,,,,
"Lovisa's Clause","Knowledge Sharing between Insurer and Insured in relation to Sustainable Practices and Climate Risk","Yes",,"Insurance","Financials","Insurance","No","""Finance, Accounting & Tax"",Resilience (Mitigation & Adaptation) ","Pre-Contract","Risk & Insurance",,"Biodiversity",,,,,,,,,,,
"Millie's Clause","Incentives for the Insured to Disclose and Meet GHG Emissions Targets","Yes",,"Insurance","Financials","Insurance","No","""Finance, Accounting & Tax"",Resilience (Mitigation & Adaptation) ","Pre-Contract","Risk & Insurance",,,,,,,,,,,,,
"Paolo's Clause","Allowing Repair or Refurbishment rather than Renewal at Point of Claim","Yes",,"Insurance","Financials","Insurance","No","""Finance, Accounting & Tax"",Resilience (Mitigation & Adaptation) ","Pre-Contract","Risk & Insurance",,,,,,,,,,,,,
"Nemo's Clause","Parametric insurance Solutions and Incentives for the Protection of Coral Reefs","Yes",,"Insurance","Financials ,Industrials,Consumer Discretionary","Insurance,Transportation ,Consumer Services ","No","""Finance, Accounting & Tax"",Oceans and Coastal Zones","Pre-Contract","Risk & Insurance",,"Biodiversity",,,,,,,,,,,
"Camden's Clause","Land Use Conditions Requiring Installation of Individual Water Meters or Submeters for Multi-Unit Properties","Yes","USA","""Buildings & Land (including Property, Construction, Environment & Planning)""","Real Estate,Industrials,Utilities","Real Estate,Capital Goods,Utilities","No","Water,""Human Settlements, Buildings and Infrastructure""","Performance","""Real Estate, Construction & Development""",,,,,,,,,,,,,
"Evie's Clause","Debt Finance Clauses (and LMA Facility Amendments) Promoting Sustainable Water Usage","Yes",,"""Finance, Financial Services & Capital Markets""","Financials ,Utilities","Diversified Financials ,Utilities","No","Water,""Finance, Accounting & Tax""","Pre-Contract","Financing & Investment",,,,,,,,,,,,,
"Jamie's Clause","Encouraging the Use of Water Submeters to Assess Water Charges against Tenants and Condominium Unit Owners","Yes","USA","""Buildings & Land (including Property, Construction, Environment & Planning)""","Real Estate,Utilities","Real Estate,Utilities","No","Water,""Human Settlements, Buildings and Infrastructure""","Performance","""Real Estate, Construction & Development""",,,,,,,,,,,,,
"Lagatha's Clause","Auditing Water Usage in Supply Chains","Yes",,"Commercial,Supply Chains","Universal,Utilities","Universal,Utilities","No","Water,Law & Legal Structures ","Performance","Supply Chain",,,,,,,,,,,,,
"Ragnar's Clause","Green Articles of Association for Private Limited Companies","Yes",,"Corporate ","Universal","Universal","No","Law & Legal Structures","Pre-Contract","Corporate Governance","Scope 1,Scope 2,Scope 3",,,,,,,,,,,,
"Aiden's Clause","Fuel Reporting for Shipping Charterparties","Yes",,"""Heavy Industry (including Energy, Infrastructure & Transport)""","Energy ,Industrials","Energy ,Transportation ","No","Transport,Oceans and Coastal Zones","Performance","""Energy, Infrastructure & Transport """,,,,,,,"""Reporting to contract parties or related third parties (investors, shareholders, insurers) "",""Other reporting obligation (regulatory, trade practice)""",,"Disincentive",,,,
"Ariel's Clause","Cost-Sharing of Fuel Efficiency Investments in Time Chartered Vessels","Yes",,"""Heavy Industry (including Energy, Infrastructure & Transport)""","Energy ,Industrials","Energy ,Transportation ","No","Transport,Oceans and Coastal Zones","Performance","""Energy, Infrastructure & Transport """,,,,,,,,,,,,,
"Bradleigh's Clause","Maximising the Laden Ratio of Vessels in Shipping Charterparties","Yes",,"""Heavy Industry (including Energy, Infrastructure & Transport)""","Industrials","Transportation","No","Transport,Oceans and Coastal Zones","Performance","""Energy, Infrastructure & Transport """,,,,,,,,,,,,,
"Madhavi's Clause","Modern Methods of Construction (MMC) and Net Zero Provisions for Construction or Development Agreements","Yes",,"""Buildings & Land (including Property, Construction, Environment & Planning)""","Industrials,Materials,Utilities,Real Estate","Capital Goods,Materials ,Utilities,Real Estate","No","""Human Settlements, Buildings and Infrastructure""","Performance","""Real Estate, Construction & Development""",,,,,,,,,,,,,
"Rose's Clause","GHG Emissions Management Plans in Infrastructure and Construction Project Finance","Yes",,"""Buildings & Land (including Property, Construction, Environment & Planning)"",""Finance, Financial Services & Capital Markets"",Public Sector (including Public Law & Local Government)","Industrials,Financials ,Materials","Capital Goods,Diversified Financials ,Banks,Materials ,Transportation ","No","""Human Settlements, Buildings and Infrastructure"",""Finance, Accounting & Tax"",Resilience (Mitigation & Adaptation) ","Pre-Contract,Procurement ","Financing & Investment",,,,,,,,,,,,,
"Josie's Clause","Net Zero Modifications for NEC4 Engineering and Construction Contracts","Yes",,"""Buildings & Land (including Property, Construction, Environment & Planning)""","Industrials","Capital Goods","No","""Human Settlements, Buildings and Infrastructure""","Performance","""Real Estate, Construction & Development""","Scope 1,Scope 2,Scope 3","Biodiversity","Just Transition",,,,,,,,,,
"Raphael's Procurement DDQ","Climate Change Due Diligence Questionnaire for Suppliers","Yes",,"Public Sector (including Public Law & Local Government),Commercial","Universal","Universal","No","""Human Settlements, Buildings and Infrastructure""","Procurement","Diligence","Scope 1,Scope 2,Scope 3",,"Just Transition",,,,,,,,,,
"Robyn's Questionnaire","Subcontractor/Supplier Self-Assessment Climate Questionnaire (Construction)","Yes",,"""Buildings & Land (including Property, Construction, Environment & Planning)"",Commercial","Industrials,Real Estate","Capital Goods,Real Estate","No","""Human Settlements, Buildings and Infrastructure""","Procurement","Diligence","Scope 1,Scope 3",,,,,,,,,,,,
"Griff's Clause","Template Board Paper for Significant Contracts/Transactions","Yes",,"Corporate ","Universal","Universal","No","Law & Legal Structures","Pre-Contract","Corporate Governance",,,,,,,,,,,,,
"Elsie's Clause","Shareholder Resolutions relating to a Company's Climate Change Commitments","Yes",,"Corporate ","Universal","Universal","No","Law & Legal Structures","Pre-Contract","Corporate Governance",,,,,,,,,,,,,
"Lila's Clause","Board Paper Implementing Net Zero for SMEs","Yes",,"Corporate ","Universal","Universal","No","Law & Legal Structures","Pre-Contract","Corporate Governance",,,,,,,,,,,,,
"Noah's Clause",,,,"Corporate ","Universal","Universal","No","Law & Legal Structures","Pre-Contract","Corporate Governance",,,,,,,,,,,,,
"Sasha's Clause","Net Zero within Company Whistleblowing Policies","Yes",,"Corporate ,Commercial","Universal","Universal","No","Law & Legal Structures","Pre-Contract","Corporate Governance",,,,,,,,,,,,,
"Emilio's Clause","Climate Policy Footprint","Yes",,"Corporate ,Commercial,""Finance, Financial Services & Capital Markets"",Insurance,Universal","Universal","Universal","No","Law & Legal Structures","Pre-Contract","Corporate Governance",,,,,,,,,,,,,
"Javier's Clause","Stakeholder Company Climate Questionnaire","Yes",,"Corporate ,Employment (including Share Schemes & Incentives & Pensions),Commercial","Universal","Universal","No","Law & Legal Structures","Pre-Contract","Corporate Governance",,,,,,,,,,,,,
"Pasfield's Clause","Paris Aligned Company Articles","Yes",,"Corporate ","Universal","Universal","No","Law & Legal Structures","Pre-Contract","Corporate Governance",,,,,,,,,,,,,
"Sebastian's Clause","Entire Business Net Zero Objectives","Yes",,"Universal","Universal","Universal","No","Law & Legal Structures","Performance","Supply Chain",,,,,,,,,,,,,
"Eddie's Recitals","Climate Recitals","Yes",,"Universal,Supply Chains","Universal","Utilities",,"Law & Legal Structures","Performance","Supply Chain - Boilerplate",,,,,,,,,,,,,
"Suki's Clause","Model Smart Mobility Data Sharing Agreement",,,"Commercial,""IP, IT, TMT, Life Sciences, Data Protection & Information Law""","Industrials,Information Technology,Communication Services,Utilities,Universal","Transportation","No","Law & Legal Structures","Procurement ,Performance ","Invitation to Tender",,,,,,,,,,,,,
"Ayshe's Clause","Transparent Sourcing of Greener and Fairer Renewable Energy",,,"""Buildings & Land (including Property, Construction, Environment & Planning)"",Commercial,Corporate ,Public Sector (including Public Law & Local Government),Universal","Energy ,Materials,Industrials,Utilities","Energy ,Materials ,Capital Goods,Utilities","No","Energy",,,,,,,,,,,,,,,
"Matilda's Annex","The Net Zero Standard for Suppliers","Yes",,"Commercial,Supply Chains","Universal","Universal","No","Law & Legal Structures","Procurement ,Performance ","Supply Chain - Boilerplate ,Supply Chain",,,,,,,,,,,,,
